Title,Authors,Year,DOI,URL,DBLP Key,Pages,Type,Tags
Examining Age-Bias and Stereotypes of Aging in LLMs,Sherwin Dewan; Ismail Shaikh; Connie Shaw; Abhilash Sahoo; Akshita Jha; Alisha Pradhan,2025,10.1145/3663547.3746464,https://doi.org/10.1145/3663547.3746464,conf/assets/DewanSSSJP25,1-9,inproceedings,Generative AI
"""Before, I Asked My Mom, Now I Ask ChatGPT"": Visual Privacy Management with Generative AI for Blind and Low-Vision People",Tanusree Sharma; Yu-Yun Tseng; Lotus Zhang; Ayae Ide; Kelly Avery Mack; Leah Findlater; Danna Gurari; Yang Wang 0005,2025,10.1145/3663547.3746335,https://doi.org/10.1145/3663547.3746335,conf/assets/SharmaTZIMFG025,1-14,inproceedings,Generative AI
"""Trying to Piece It Together"": Exploring Accessible Error Detection in Emerging Privacy Techniques With Blind People",Rahaf Alharbi; Angela D. Cheong; Jaylin Herskovitz; Robin N. Brewer; Sarita Schoenebeck,2025,10.1145/3663547.3746376,https://doi.org/10.1145/3663547.3746376,conf/assets/AlharbiCHBS25,1-20,inproceedings,
How Can Assistance and Its Disclosure Promote Fairness in Inclusive Esports?,Shuto Sako; Tomoki Ikeda; Ryosuke Aoki; Akihiro Miyata,2025,10.1145/3663547.3746368,https://doi.org/10.1145/3663547.3746368,conf/assets/SakoIAM25,1-10,inproceedings,
Co-Designing Culturally Grounded Mobile Health Games for Hypertension Management in Indigenous Communities,Alison Graham; Tochukwu Arinze Ikwunne; Jared Duval,2025,10.1145/3663547.3746321,https://doi.org/10.1145/3663547.3746321,conf/assets/GrahamID25,1-11,inproceedings,
Designing with Tensions: Understanding Professionals' Needs in Integrating AI Chatbots for Wheelchair Assessment Services in Low- and Middle-Income Countries,Wen Mo; Aneesha Singh; Amid Ayobi; Catherine Holloway,2025,10.1145/3663547.3746340,https://doi.org/10.1145/3663547.3746340,conf/assets/MoSAH25,1-19,inproceedings,
Executive Dysfunction by Design: A Cognitive Accessibility Analysis of AI Support vs. Healthcare Barriers,Meredith Moore 0001,2025,10.1145/3663547.3749831,https://doi.org/10.1145/3663547.3749831,conf/assets/000125,1-5,inproceedings,
"""It was Mentally Painful to Try and Stop"": Design Opportunities for Just-in-Time Interventions for People with Obsessive-Compulsive Disorder in the Real World",Ru Wang 0002; Kexin Zhang 0002; Yuqing Wang 0012; Keri Brown; Yuhang Zhao 0001,2025,10.1145/3663547.3746394,https://doi.org/10.1145/3663547.3746394,conf/assets/WangZWBZ25,1-18,inproceedings,
"PunchPulse: A Physically Demanding Virtual Reality Boxing Game Designed with, for and by Blind and Low-Vision Players",Sanchita S. Kamath; Omar Khan 0004; Anurag Choudhary; Jan Meyerhoff-Liang; Soyoung Choi; Jooyoung Seo,2025,10.1145/3663547.3746365,https://doi.org/10.1145/3663547.3746365,conf/assets/KamathKCMCS25,1-21,inproceedings,
A Low-Fidelity Prototyping Method for Blind Users: A Case Study on Designing Two-Dimensional Tactile Displays,Sara Alzalabny; Karin Müller 0001; Kathrin Gerling; Thorsten Schwarz; Bastian E. Rapp; Rainer Stiefelhagen,2025,10.1145/3663547.3746397,https://doi.org/10.1145/3663547.3746397,conf/assets/Alzalabny0GSRS25,1-14,inproceedings,
Beyond Beautiful: Embroidering Legible and Expressive Tactile Graphics,Margaret Ellen Seehorn; Claris Winston; Bo Liu 0091; Gene S.-H. Kim; Emily White; Nupur Gorkar; Kate S. Glazko; Aashaka Desai; Jerry Cao; Megan Hofmann; Jennifer Mankoff,2025,10.1145/3663547.3746336,https://doi.org/10.1145/3663547.3746336,conf/assets/SeehornW0KWGGDC25,1-21,inproceedings,Data Science
Benthic: Perceptually Congruent Structures for Accessible Charts and Diagrams,Catherine Mei; Josh Pollock; Daniel Hajas; Jonathan Zong; Arvind Satyanarayan,2025,10.1145/3663547.3746342,https://doi.org/10.1145/3663547.3746342,conf/assets/MeiPHZS25,1-17,inproceedings,Data Science
Leveraging Dynamic Audio-Tactile UIs to Assist Visually Impaired Users in Exploring Line Charts through Tactile Graphic Readers,Gaspar Ramôa; Karin Müller 0001,2025,10.1145/3663547.3746398,https://doi.org/10.1145/3663547.3746398,conf/assets/Ramoa025,1-15,inproceedings,Data Science
Tactile Data Comics: Combining Step-by-step Presentation of Tactile Graphics with Verbal Narration for the Blind and Visually Impaired,Yang Jiao; Ruoting Sun; Rong Luo; Xiwen Yao; Xinran She; Kotaro Hara; Yuewen Zhang; Xinyi Fu 0003,2025,10.1145/3663547.3746338,https://doi.org/10.1145/3663547.3746338,conf/assets/JiaoSLYSHZF25,1-14,inproceedings,Data Science
Characterizing Smart Home Technology Usage Among Users with Disabilities through Reddit,Rebecca Moore; Jason Wiese,2025,10.1145/3663547.3746328,https://doi.org/10.1145/3663547.3746328,conf/assets/MooreW25,1-14,inproceedings,
Exploring Shared Augmented Reality for Low-Vision Training of Activities of Daily Living,Yong-Joon Thoo; Karim Aebischer; Nicolas Ruffieux; Denis Lalanne,2025,10.1145/3663547.3746371,https://doi.org/10.1145/3663547.3746371,conf/assets/ThooARL25,1-19,inproceedings,
More than One Step at a Time: Designing Procedural Feedback for Non-visual Makeup Routines,Franklin Mingzhe Li; Akihiko Oharazawa; Chloe Qingyu Zhu; Misty Fan; Daisuke Sato 0001; Chieko Asakawa; Patrick Carrington,2025,10.1145/3663547.3746366,https://doi.org/10.1145/3663547.3746366,conf/assets/LiOZF0AC25,1-17,inproceedings,
Exploring Object Status Recognition for Recipe Progress Tracking in Non-Visual Cooking,Franklin Mingzhe Li; Kaitlyn Ng; Bin Zhu 0006; Patrick Carrington,2025,10.1145/3663547.3746318,https://doi.org/10.1145/3663547.3746318,conf/assets/LiN0C25,1-15,inproceedings,
"Check Now, Can You See It?: Exploring Voice and Video-Capable Language Models for Identifying and Spatially Locating Items of Interest for Blind and Low-Vision Travelers",Aziz N. Zeidieh; Jooyoung Seo,2025,10.1145/3663547.3749833,https://doi.org/10.1145/3663547.3749833,conf/assets/ZeidiehS25,1-5,inproceedings,
"""Where Can I Park?"" Understanding Human Perspectives and Scalably Detecting Disability Parking from Aerial Imagery",Jared Hwang; Chu Li 0001; Hanbyul Kang; Maryam Hosseini; Jon E. Froehlich,2025,10.1145/3663547.3746377,https://doi.org/10.1145/3663547.3746377,conf/assets/HwangLKHF25,1-20,inproceedings,
Beyond Individual Accommodations: The Collaborative Practices of ADHD Students in Post-Secondary Education,Vitica X. Arnold; Aehong Min; Clarisse Bonang; Sohyeon Park; Gillian R. Hayes; Anne Marie Piper,2025,10.1145/3663547.3746324,https://doi.org/10.1145/3663547.3746324,conf/assets/ArnoldMBPHP25,1-14,inproceedings,
Rethinking Productivity with GenAI: A Neurodivergent Students' Perspective,Hira Jamshed; Mustafa Naseem; Venkatesh Potluri; Robin N. Brewer,2025,10.1145/3663547.3746329,https://doi.org/10.1145/3663547.3746329,conf/assets/JamshedNPB25,1-16,inproceedings,Generative AI
"Navigating STEM Doctoral Programs with ADHD: Barriers, Workflow Challenges, and Adaptive Strategies",Paul Ezeamii; Kristen Shinohara,2025,10.1145/3663547.3746325,https://doi.org/10.1145/3663547.3746325,conf/assets/EzeamiiS25,1-13,inproceedings,
Life as an International Computer Science PhD Student with Cerebral Palsy,Tianchi Mo; Humphrey Curtis; Timothy Neate,2025,10.1145/3663547.3749835,https://doi.org/10.1145/3663547.3749835,conf/assets/MoCN25,1-7,inproceedings,
"""I Felt Like I Was in a Fishbowl"": Lived Experience with Telepresence and Non-Visible Disabilities in Higher Education",Hanlin Zhang; Yifan Feng; Adam Walker; Jennifer A. Rode,2025,10.1145/3663547.3746363,https://doi.org/10.1145/3663547.3746363,conf/assets/ZhangFWR25,1-15,inproceedings,
"Expanding Norms, Negotiating Bodies: How Artists with Disabilities Perceive and Use Creative Tools",Miriam Brody; Izabella Rodrigues; Jane L. E; Jingyi Li,2025,10.1145/3663547.3746331,https://doi.org/10.1145/3663547.3746331,conf/assets/BrodyREL25,1-14,inproceedings,
Understanding the Video Content Creation Journey of Creators with Sensory Impairment in Kenya,Lan Xiao; Maryam Bandukda; Franklin Mingzhe Li; Mark Colley; Catherine Holloway,2025,10.1145/3663547.3746356,https://doi.org/10.1145/3663547.3746356,conf/assets/XiaoBLCH25,1-14,inproceedings,
VizXpress: Towards Expressive Visual Content by Blind Creators Through AI Support,Lotus Zhang; Zhuohao (Jerry) Zhang; Gina Clepper; Franklin Mingzhe Li; Patrick Carrington; Jacob O. Wobbrock; Leah Findlater,2025,10.1145/3663547.3746345,https://doi.org/10.1145/3663547.3746345,conf/assets/ZhangZCLCWF25,1-18,inproceedings,
GestureVoice: Enabling Multimodal Text Editing for Blind Users Using Gestures and Voice,Prerna Khanna; Monalika Padma Reddy; I. V. Ramakrishnan; Xiaojun Bi 0001; Aruna Balasubramanian,2025,10.1145/3663547.3746388,https://doi.org/10.1145/3663547.3746388,conf/assets/KhannaRR0B25,1-15,inproceedings,
In Sync: Exploration of a Multi-sensory Artefact for Dance Accessibility with People who are Blind or Have Low Vision and Dance Teachers,Madhuka Thisuri De Silva; Jim Smiley; Leona M. Holloway; Sarah Goodwin; Matthew Butler 0002,2025,10.1145/3663547.3746367,https://doi.org/10.1145/3663547.3746367,conf/assets/SilvaSHG025,1-21,inproceedings,
NeuroBridge: Using Generative AI to Bridge Cross-neurotype Communication Differences through Neurotypical Perspective-taking,Rukhshan Haroon; Kyle Wigdor; Katie Yang; Nicole Toumanios; Eileen T. Crehan; Fahad R. Dogar,2025,10.1145/3663547.3746337,https://doi.org/10.1145/3663547.3746337,conf/assets/HaroonWYTCD25,1-19,inproceedings,Generative AI
Helping or Homogenizing? GenAI as a Design Partner to Pre-Service SLPs for Just-in-Time Programming of AAC,Cynthia Zastudil; Christine Holyfield; Christine Kapp; Kate Hamilton; Kriti Baru; Liam Newsam; June A. Smith; Stephen MacNeil,2025,10.1145/3663547.3746384,https://doi.org/10.1145/3663547.3746384,conf/assets/ZastudilHKHBNSM25,1-18,inproceedings,Generative AI
"""An Old Bastard in Bright Orange Satin!"": Zuzenna's Aphasia Diary: And Lessons Learned from DIY Augmentative and Alternative Communication",Humphrey Curtis; Filip Bircanin; Timothy Neate,2025,10.1145/3663547.3746369,https://doi.org/10.1145/3663547.3746369,conf/assets/CurtisBN25,1-20,inproceedings,
One Does Not Simply 'Mm-hmm': Exploring Backchanneling in the AAC Micro-Culture,Tobias M. Weinberg; Claire O'Connor; Ricardo E. Gonzalez Penuela; Stephanie Valencia; Thijs Roumen,2025,10.1145/3663547.3746381,https://doi.org/10.1145/3663547.3746381,conf/assets/WeinbergOPVR25,1-14,inproceedings,
Exploring the Usability of Gaze-based Mobile Communication in Ghana,Victoria Austin; Gifty Ayoka; Giulia Barbareschi; Richard Cave; Catherine Holloway,2025,10.1145/3663547.3746395,https://doi.org/10.1145/3663547.3746395,conf/assets/AustinABCH25,1-13,inproceedings,
CoSignPlay: A Collaborative Approach to Learning Non-Manual Signs in ASL for Hearing Families with Deaf Children,Xuanyu Liu; Hsin-Le Cheng; Guillaume Chastel; Margaret Chastel; Zhen Bai 0002,2025,10.1145/3663547.3746382,https://doi.org/10.1145/3663547.3746382,conf/assets/LiuCCC025,1-16,inproceedings,
"Investigating ""Touch and Talk"" for Blind and Low Vision People: Science Communication Assistance Through Exploring Multiple Tactile Objects",Ayaka Tsutsui; Xiyue Wang; Hironobu Takagi; Chieko Asakawa,2025,10.1145/3663547.3746373,https://doi.org/10.1145/3663547.3746373,conf/assets/TsutsuiWTA25,1-21,inproceedings,
"Engaging Visually Impaired People in Science Museums Through an Immersive Workshop: Practices, Challenges, and Opportunities",Xiyue Wang; Seita Kayukawa; Hironobu Takagi; Chieko Asakawa,2025,10.1145/3663547.3746348,https://doi.org/10.1145/3663547.3746348,conf/assets/WangKTA25,1-18,inproceedings,
Generative AI for Teachers with Vision Impairments in the Global South: A Bridge Too Far?,Manohar Swaminathan 0001; Tarini Naik,2025,10.1145/3663547.3746392,https://doi.org/10.1145/3663547.3746392,conf/assets/0001N25,1-18,inproceedings,Generative AI
VeasyGuide: Personalized Visual Guidance for Low-vision Learners on Instructor Actions in Presentation Videos,Yotam Sechayk; Ariel Shamir; Amy Pavel; Takeo Igarashi,2025,10.1145/3663547.3746372,https://doi.org/10.1145/3663547.3746372,conf/assets/SechaykSPI25,1-18,inproceedings,
Making Lecture Videos Accessible for Students who are Blind or have Low Vision through AI-Assisted Navigation and Visual Question Answering,Katharina Anderer; Karin Müller 0001; Lukas Strobel; Matthias Wölfel; Jan Niehues; Kathrin Gerling,2025,10.1145/3663547.3746349,https://doi.org/10.1145/3663547.3746349,conf/assets/Anderer0SWNG25,1-15,inproceedings,
Minor Resistance: The Everyday Politics and Power Dynamics of Assistive Technology Adoption,Stacy Hsueh; Danielle Van Dusen; Anat Caspi; Jennifer Mankoff,2025,10.1145/3663547.3746465,https://doi.org/10.1145/3663547.3746465,conf/assets/HsuehDCM25,1-16,inproceedings,
"Designing Through Lived Experience: Reflections on Control, Embodiment, and Social Bias in Accessibility Research",Atieh Taheri; Misha Sra; Patrick Carrington; Jeffrey P. Bigham,2025,10.1145/3663547.3749829,https://doi.org/10.1145/3663547.3749829,conf/assets/TaheriSCB25,1-7,inproceedings,
"The Fears, The Hopes, The Oscillations: A Critical Analysis of Tech Startups Targeting Autism",Yihe Wang; Bhavani Seetharaman; Rosemary Steup; Norman Makoto Su; Kathryn E. Ringland,2025,10.1145/3663547.3746379,https://doi.org/10.1145/3663547.3746379,conf/assets/WangSSSR25,1-17,inproceedings,
Exploring Collaboration to Center the Deaf Community in Sign Language AI,Rie Kamikubo; Abraham Glasser; Alex X. Lu; Hal Daumé III; Hernisa Kacorri; Danielle Bragg,2025,10.1145/3663547.3746390,https://doi.org/10.1145/3663547.3746390,conf/assets/KamikuboGLDKB25,1-18,inproceedings,
The Blind Leading the Blind: Designing a Co-Creation Workshop for Visually Impaired and Sighted Participants by a Visually Impaired Researcher,Peter A Hayton; Alexander Wilson; Ben Morris 0003; Jayne Dent; Clara Crivellaro,2025,10.1145/3663547.3749834,https://doi.org/10.1145/3663547.3749834,conf/assets/HaytonW0DC25,1-8,inproceedings,
Crippin' WhatsApp's Interaction Design: Learnings from the blind/visually impaired users of India,Hrittika Bhowmick; Atharva Shrivastava; Sandeep Ysp; Shilpaa Anand; Dipanjan Chakraborty 0002,2025,10.1145/3663547.3746389,https://doi.org/10.1145/3663547.3746389,conf/assets/BhowmickSYA025,1-16,inproceedings,
"Do you overreact to pressure, blow things out of proportion?: An ADHD-Centered Critical Review of Emotional Dysregulation Measures",Deepak Giri; Júlia Hellín López; Celeste Campos-Castillo; Megh Marathe,2025,10.1145/3663547.3746378,https://doi.org/10.1145/3663547.3746378,conf/assets/GiriLCM25,1-16,inproceedings,
Benchmarking PDF Accessibility Evaluation: A Dataset and Framework for Assessing Automated and LLM-Based Approaches for Accessibility Testing,Anukriti Kumar; Tanushree Padath; Lucy Lu Wang,2025,10.1145/3663547.3746380,https://doi.org/10.1145/3663547.3746380,conf/assets/KumarPW25,1-24,inproceedings,Generative AI
Characterizing Visual Intents for People with Low Vision through Eye Tracking,Ru Wang 0002; Ruijia Chen; Anqiao Erica Cai; Zhiyuan Li; Sanbrita Mondal; Yuhang Zhao 0001,2025,10.1145/3663547.3746391,https://doi.org/10.1145/3663547.3746391,conf/assets/WangCCLMZ25,1-18,inproceedings,
Surfacing Variations to Calibrate Perceived Reliability of MLLM-generated Image Descriptions,Meng Chen 0020; Akhil Iyer; Amy Pavel,2025,10.1145/3663547.3746393,https://doi.org/10.1145/3663547.3746393,conf/assets/ChenIP25,1-17,inproceedings,
A Review of 25 Years of Human-Computer Interaction Research on Reading Support Technologies for People with Disabilities Published in the ACM Digital Library,Oliver Alonzo; Saad Hassan,2025,10.1145/3663547.3746355,https://doi.org/10.1145/3663547.3746355,conf/assets/AlonzoH25,1-21,inproceedings,
SoundNarratives: Rich Auditory Scene Descriptions to Support Deaf and Hard of Hearing People,Liang-Yuan Wu; Dhruv Jain,2025,10.1145/3663547.3746341,https://doi.org/10.1145/3663547.3746341,conf/assets/WuJ25,1-15,inproceedings,
Characterizing Collective Efforts in Content Sharing and Quality Control for ADHD-relevant Content on Video-sharing Platforms,Hanxiu 'Hazel' Zhu; Avanthika Senthil Kumar; Sihang Zhao; Ru Wang 0002; Xin Tong 0004; Yuhang Zhao 0001,2025,10.1145/3663547.3746387,https://doi.org/10.1145/3663547.3746387,conf/assets/ZhuKZ00025,1-15,inproceedings,
FocusView: Understanding and Customizing Informational Video Watching Experiences for Viewers with ADHD,Hanxiu 'Hazel' Zhu; Ruijia Chen; Yuhang Zhao 0001,2025,10.1145/3663547.3746386,https://doi.org/10.1145/3663547.3746386,conf/assets/ZhuC025,1-18,inproceedings,
Probing the Gaps in ChatGPT's Live Video Chat for Real-World Assistance for People who are Blind or Visually Impaired,Ruei-Che Chang; Rosiana Natalie; Wenqian Xu; Jovan Zheng Feng Yap; Anhong Guo,2025,10.1145/3663547.3746319,https://doi.org/10.1145/3663547.3746319,conf/assets/ChangNXYG25,1-14,inproceedings,Generative AI
CuCap: Comparative Analysis of Customized Captioning between North American and South Korean d/Deaf and Hard-of-Hearing Users,Caluã de Lacerda Pataca; Sooyeon Ahn 0001; Suhyeon Yoo; JooYeong Kim; Khai N. Truong; Jin-Hyuk Hong; Roshan L. Peiris; Matt Huenerfauth,2025,10.1145/3663547.3746400,https://doi.org/10.1145/3663547.3746400,conf/assets/PatacaAYKTHPH25,1-20,inproceedings,
CARTGPT: Real-Time Correction of CART Captions Using Large Language Models,Liang-Yuan Wu; Andrea Kleiver; Dhruv Jain,2025,10.1145/3663547.3746326,https://doi.org/10.1145/3663547.3746326,conf/assets/WuKJ25,1-11,inproceedings,Generative AI
CapTune: Adapting Non-Speech Captions With Anchored Generative Models,Jeremy Zhengqi Huang; Caluã de Lacerda Pataca; Liang-Yuan Wu; Dhruv Jain,2025,10.1145/3663547.3746346,https://doi.org/10.1145/3663547.3746346,conf/assets/HuangPWJ25,1-18,inproceedings,
"""I Want to Connect, But..."": Exploring Socially Isolated Older Adults' Views on Social Engagement and Technology for Connecting",Chia Hsin (Josette) Lee; Rachana Nataraj; Aqueasha Martin-Hammond,2025,10.1145/3663547.3746354,https://doi.org/10.1145/3663547.3746354,conf/assets/LeeNM25,1-16,inproceedings,
Understanding How Visually Impaired Players Socialize in Mobile Games,Zihe Ran; Xiyu Li; Qing Xiao 0002; Yanyun Wang 0010; Franklin Mingzhe Li; Zhicong Lu,2025,10.1145/3663547.3746385,https://doi.org/10.1145/3663547.3746385,conf/assets/RanL00LL25,1-16,inproceedings,
"Modeling Accessibility: Characterizing What We Mean by ""Accessible""",Kelly Avery Mack; Jesse J. Martinez; Aaleyah Lewis; Jennifer Mankoff; James Fogarty; Leah Findlater; Heather D. Evans; Cynthia L. Bennett; Emma J. McDonnell,2025,10.1145/3663547.3746344,https://doi.org/10.1145/3663547.3746344,conf/assets/MackMLMFFEBM25,1-20,inproceedings,
Exploring Disability Culture Through Accounts of Disabled Innovators of Accessibility Technology,Aashaka Desai; Jennifer Mankoff; Richard E. Ladner,2025,10.1145/3663547.3746330,https://doi.org/10.1145/3663547.3746330,conf/assets/DesaiML25,1-14,inproceedings,
Temp access: Reflecting on multimodal GAI as an accessibility technology for temporary disability,Kate S. Glazko,2025,10.1145/3663547.3749830,https://doi.org/10.1145/3663547.3749830,conf/assets/Glazko25,1-7,inproceedings,
Toward a Multi-layer Framework to Assess the Quality of Life Impact of Smartphones as Assistive Technology for People with Sensory Disabilities in Kenya,Maryam Bandukda; Lan Xiao; Giulia Barbareschi; Philip Oyier; Henry Athiany; Wallace M. Karuguti; Mwangi J. Matheri; Victoria Austin; Catherine Holloway,2025,10.1145/3663547.3746352,https://doi.org/10.1145/3663547.3746352,conf/assets/BandukdaXBOAKMA25,1-16,inproceedings,
"""As Someone Who is Disabled, I am so thankful for Sex Work"": Alternative Approaches to Access Among Disabled Sex-Workers",Jay Rodolitz; Vaughn Hamilton; Madiha Tabassum; Ada Lerner; Megan Hofmann,2025,10.1145/3663547.3746375,https://doi.org/10.1145/3663547.3746375,conf/assets/RodolitzHTLH25,1-15,inproceedings,
Disclosure of Neurodivergence in Software Workplaces: a Mixed Methods Study of Forum and Survey Perspectives,Kaia Newman; Sarah Snay; Madeline Endres; Manasvi Parikh; Andrew Begel,2025,10.1145/3663547.3746334,https://doi.org/10.1145/3663547.3746334,conf/assets/NewmanSEPB25,1-17,inproceedings,
Understanding Human-AI Misalignment in LLM-Based Job-Seeking Support for Neurodivergent Users,Kaely Hall; Marcus Ma; Xinyue Zhang; Vedant Das Swain; Jennifer G. Kim,2025,10.1145/3663547.3746361,https://doi.org/10.1145/3663547.3746361,conf/assets/HallMZSK25,1-13,inproceedings,Generative AI
A11yShape: AI-Assisted 3-D Modeling for Blind and Low-Vision Programmers,Zhuohao (Jerry) Zhang; Haichang Li; Chun Meng Yu; Faraz Faruqi; Junan Xie; Gene S.-H. Kim; Mingming Fan 0001; Angus G. Forbes; Jacob O. Wobbrock; Anhong Guo; Liang He 0005,2025,10.1145/3663547.3746362,https://doi.org/10.1145/3663547.3746362,conf/assets/ZhangLYFXK0FWG025,1-20,inproceedings,
Beyond Accessibility: Understanding the Ease of Use and Impacts of Digital Collaboration Tools for Blind and Low Vision Workers,Taslima Akter; Aparajita S. Marathe; Darren Gergle; Anne Marie Piper,2025,10.1145/3663547.3746332,https://doi.org/10.1145/3663547.3746332,conf/assets/AkterMGP25,1-17,inproceedings,
DescribePro: Collaborative Audio Description with Human-AI Interaction,Maryam S. Cheema; Sina Elahimanesh; Samuel Martin; Pooyan Fazli; Hasti Seifi,2025,10.1145/3663547.3746320,https://doi.org/10.1145/3663547.3746320,conf/assets/CheemaEMFS25,1-19,inproceedings,
From Cluttered to Clear: Improving the Web Accessibility Design for Screen Reader Users in E-commerce With Generative AI,Yaman Yu; Bektur Ryskeldiev; Ayaka Tsutsui; Matthew Gillingham; Yang Wang 0005,2025,10.1145/3663547.3746353,https://doi.org/10.1145/3663547.3746353,conf/assets/YuRTGW25,1-19,inproceedings,Generative AI
AccessGuru: Leveraging LLMs to Detect and Correct Web Accessibility Violations in HTML Code,Nadeen Fathallah; Daniel Hernández 0002; Steffen Staab,2025,10.1145/3663547.3746360,https://doi.org/10.1145/3663547.3746360,conf/assets/Fathallah0S25,1-22,inproceedings,Generative AI
Task Mode: Dynamic Filtering for Task-Specific Web Navigation using LLMs,Ananya Gubbi Mohanbabu; Yotam Sechayk; Amy Pavel,2025,10.1145/3663547.3746401,https://doi.org/10.1145/3663547.3746401,conf/assets/MohanbabuSP25,1-18,inproceedings,Generative AI
Designing for Colour Vision Deficiency: A Scoping Review of Resources That Support Designers in Choosing Accessible Colours,Connor Geddes; Edward Curran Eggertson; Jonathan Sutton; Garreth W. Tigwell,2025,10.1145/3663547.3746370,https://doi.org/10.1145/3663547.3746370,conf/assets/GeddesEST25,1-17,inproceedings,
Effects of Text Release Features on Communication and Problem-Solving in Teams with a Deaf/Hard of Hearing and a Hearing Member Using Automatic Speech Recognition: Effects of Text Release Features,Michael Stinson 0002; Rebecca L. Carpenter; Donna Easton,2025,10.1145/3663547.3759694,https://doi.org/10.1145/3663547.3759694,conf/assets/0002CE25,1-4,inproceedings,
Evaluating AI-Powered Website Accessibility Overlays,Parker Hartman; Tim Gorichanaz,2025,10.1145/3663547.3759761,https://doi.org/10.1145/3663547.3759761,conf/assets/HartmanG25,1-4,inproceedings,
Exploring Generative AI to Support Disability Service Professionals in Writing Image Descriptions for HCI Science Figures,Yugo Iwamoto; Muhammad Raees 0002; Jamison Heard; Garreth W. Tigwell,2025,10.1145/3663547.3759763,https://doi.org/10.1145/3663547.3759763,conf/assets/Iwamoto0HT25,1-6,inproceedings,Generative AI
Making Online Accessibility Information Accessible: Case of a Natural History Museum in Germany,Nicolas Walter; Zeynep Yildiz; Sabrina Burtscher,2025,10.1145/3663547.3759689,https://doi.org/10.1145/3663547.3759689,conf/assets/WalterYB25,1-7,inproceedings,
Can Generative AI Create Accessible Websites?,Ruchi Panchanadikar; Mitali Shrikant Bhosekar; Emma Dixon,2025,10.1145/3663547.3759755,https://doi.org/10.1145/3663547.3759755,conf/assets/PanchanadikarBD25,1-6,inproceedings,Generative AI
Speaker-dependent Continuous Speech Recognition for Individuals with Cerebral Palsy Using Weighted Finite-State Transducer and Text-to-Speech Synthesis,Takeru Otani; Ryo Aihara; Ryoichi Takashima; Tetsuya Takiguchi; Tatsuhiko Saito,2025,10.1145/3663547.3759757,https://doi.org/10.1145/3663547.3759757,conf/assets/OtaniATTS25,1-5,inproceedings,Generative AI
HaptiShare: Exploring Shared Co-Located Haptic Experiences with a Mobile Multi-Party Haptic Communication Device,Arthur Theil; Uchechukwu Aghedo; Christina Karpodini; Tychonas Michailidis,2025,10.1145/3663547.3759736,https://doi.org/10.1145/3663547.3759736,conf/assets/TheilAKM25,1-5,inproceedings,
Segmentation-Based Approach Towards Detecting Improperly Installed Tactile Paving,Riki Tokita; Yusei Ikeda; Kenro Go; Eisei Nakahara; Akihiro Miyata,2025,10.1145/3663547.3759735,https://doi.org/10.1145/3663547.3759735,conf/assets/TokitaIGNM25,1-5,inproceedings,
Accessible Slide Presentation via Intelligent Real-time Editing: Insights from a Wizard-of-Oz Study,Azizul Haque; Jonggi Hong,2025,10.1145/3663547.3759719,https://doi.org/10.1145/3663547.3759719,conf/assets/HaqueH25,1-4,inproceedings,
Left to their own devices: How people with ALS use digital platforms as advocacy space,Carly Atwell; Nastaran Jadidi; Vineet Pandey,2025,10.1145/3663547.3759728,https://doi.org/10.1145/3663547.3759728,conf/assets/AtwellJP25,1-4,inproceedings,
The State of Climate Change and Disability: A Survey,Ethan Sandoval; Lily Anfang; Maya Flynn; Kaitlynn T. Gray; Gregory Wickham; Lynn Kirabo,2025,10.1145/3663547.3759741,https://doi.org/10.1145/3663547.3759741,conf/assets/SandovalAFGWK25,1-5,inproceedings,
A Depth- and Luminance-Based 2.5D Relief to Expand the Expressive Potential of Tactile Photography for People with Visual Impairments,Kosei Takaishi; Kazunori Minatani; Masakazu Iwamura,2025,10.1145/3663547.3759751,https://doi.org/10.1145/3663547.3759751,conf/assets/TakaishiMI25,1-4,inproceedings,
